"2005/02/17","","Day","02/17/2005: Bush names former U.S. Ambassador to Iraq John Neg…","Bush names former U.S. Ambassador to Iraq John Negroponte Director of National Intelligence, a newly created position of &ldquo;intelligence czar&rdquo; created in the wake of Congressional investigations into intelligence failures leading up to September 11.","George W. Bush"
"2005/02/20","2005/02/24","Day","02/20/2005: Bush travels to Europe to meet with French Preside…","Bush travels to Europe to meet with French President Jacques Chirac, German Chancellor Gerhard Schroeder, and Russian President Vladimir Putin to smooth diplomatic relations after the U.S.-led invasion of Iraq.","George W. Bush"
"2005/03/31","","Day","03/31/2005: Terri Schiavo, a Florida woman long-suffering from…","Terri Schiavo, a Florida woman long-suffering from brain damage, dies following the removal of her feeding tube. Schiavo had been the focus of legal controversy between the wishes of her parents and those of her husband. Ten days earlier, President Bush had signed a law permitting Schiavo&rsquo;s parents to challenge the removal of her feeding tube in federal court.","George W. Bush"
"2005/06/05","","Day","06/05/2005: Iraqi government announces that a war crimes trial…","Iraqi government announces that a war crimes trial for Saddam Hussein is likely to begin within the next two months and prosecutors would seek the death penalty.","George W. Bush"
"2005/06/10","","Day","06/10/2005: South Korean President Roh Moo Hyun meets with Bus…","South Korean President Roh Moo Hyun meets with Bush to discuss efforts to persuade North Korea to join the six-party talks intended to end North Korea&rsquo;s pursuit of nuclear weapons.","George W. Bush"
"2005/06/21","","Day","06/21/2005: Vietnamese Premier Phan Van Khai meets with Bush t…","Vietnamese Premier Phan Van Khai meets with Bush to discuss human rights and treatment of ethnic and religious minorities in Vietnam. This marks the first visit by a Vietnamese Premier to the United States since the country reunited under Communist rule in 1975.","George W. Bush"
"2005/06/28","","Day","06/28/2005: The Senate easily passes an omnibus energy bill ai…","The Senate easily passes an omnibus energy bill aimed at supporting the traditional energy industries of oil and natural gas, but also provide tax incentives for the use of alternative energy sources such as solar and wind power.","George W. Bush"
"2005/07/26","","Day","07/26/2005: The space shuttle Discovery takes off from the Ken…","The space shuttle Discovery takes off from the Kennedy Space Center on a mission to deliver repairs to the International Space Station. This is the first U.S. space mission since the failed return of the Columbia in 2003.","George W. Bush"
"2005/08/28","","Day","08/28/2005: Hurricane Katrina strikes the southern coast of th…","Hurricane Katrina strikes the southern coast of the United States with devastating effects. The storm breaches the levee system in New Orleans, causing massive flooding and destruction of property. The Bush administration is harshly criticized for an inadequate response by the federal government to the storm&rsquo;s destruction. ","George W. Bush"
"2005/09/29","","Day","09/29/2005: John G. Roberts is confirmed as Chief Justice of t…","John G. Roberts is confirmed as Chief Justice of the U.S. Supreme Court. Roberts replaces William Rehnquist, who died in office, and is President Bush&rsquo;s first nominee to the Court. ","George W. Bush"
"2006/01/26","","Day","01/26/2006: The Senate Judiciary Committee approves President …","The Senate Judiciary Committee approves President Bush&rsquo;s nomination of Samuel A. Alito, Jr., to the U.S. Supreme Court by a vote of 10-8. Previously, concerns were voiced over the disruption of the court&rsquo;s ideological balance that would result from Alito&rsquo;s replacement of moderate Sandra Day O&rsquo;Connor.","George W. Bush"
"2006/03/21","","Day","03/21/2006: In a White House news conference, President Bush a…","In a White House news conference, President Bush admits for the first time that the complete removal of U.S. troops from Iraq during the remainder of his term is improbable. He continues to assert the fact that progress is being made in the establishment of Iraqi democracy. ","George W. Bush"
"2006/05/03","","Day","05/03/2006: After several cases of avian influenza are reporte…","After several cases of avian influenza are reported in Central and Southeast Asia, the Bush administration proposes a plan to minimize losses in the case of a deadly pandemic. The plan includes coordination with the World Health Organization, reorganization of international travel, and the authorization of military assistance in the case of public unrest. ","George W. Bush"
"2006/05/04","","Day","05/04/2006: The U.S. District Court in Alexandria, Virginia, s…","The U.S. District Court in Alexandria, Virginia, sentences Zacarias Moussaoui to life in prison without parole for his role in the September 11, 2001, terrorist attacks. Moussaoui was the first person to stand trial for the attacks. ","George W. Bush"
"2006/06/07","","Day","06/07/2006: The Senate votes 49-48 to conclude debate on a con…","The Senate votes 49-48 to conclude debate on a constitutional amendment banning same sex marriages in the United States, thereby preventing a vote on the actual passage of the amendment. President Bush had previously expressed support of the proposed amendment.","George W. Bush"
"2006/07/19","","Day","07/19/2006: President Bush vetoes a bill to lift constraints o…","President Bush vetoes a bill to lift constraints on federal funding of embryonic stem cell research, and subsequently, the House unsuccessfully attempts to override the veto. This is the first veto Bush issues during his administration.","George W. Bush"
"2006/10/26","","Day","10/26/2006: President Bush signs a bill providing for the cons…","President Bush signs a bill providing for the construction of a 700-mile fence along the United States-Mexico border, in an effort to increase border security and stem illegal immigration.","George W. Bush"
"2006/11/07","","Day","11/07/2006: Democrats recapture control of the U.S. House and …","Democrats recapture control of the U.S. House and Senate in the midterm elections. ","George W. Bush"
"2006/12/30","","Day","12/30/2006: Former Iraqi President Saddam Hussein is hanged in…","Former Iraqi President Saddam Hussein is hanged in Baghdad, Iraq, after being convicted of crimes against humanity dating back to 1982.","George W. Bush"
"2007/01/04","","Day","01/04/2007: Nancy Pelosi, a Democrat from California, takes of…","Nancy Pelosi, a Democrat from California, takes office as the first female Speaker of the House. Democrats assume control of both the House of Representatives and the Senate.","George W. Bush"
"2007/01/08","","Day","01/08/2007: The U.S. Air Force launches an air attack on Islam…","The U.S. Air Force launches an air attack on Islamist militias and suspected al-Qaeda operatives in Somalia.","George W. Bush"
"2007/01/11","","Day","01/11/2007: Bush announces what would be t…","Bush announces what would be termed a &ldquo;troop surge&rdquo; in Iraq in an attempt to increase security in the capital of Baghdad and smother insurgency centers throughout the country.","George W. Bush"
"2007/02/10","","Day","02/10/2007: General David Petraeus takes over command of the m…","General David Petraeus takes over command of the multinational forces in Iraq to oversee the surge.","George W. Bush"
"2007/03/06","","Day","03/06/2007: Scooter Libby, Vice President …","Scooter Libby, Vice President Cheney&rsquo;s chief of staff, is convicted of perjury and obstruction of justice in the case of CIA operative, Valerie Plame Wilson, whose covert identity was exposed. President Bush later commutes Libby&rsquo;s sentence.","George W. Bush"
"2007/04/16","","Day","04/16/2007: Seung-Hui Cho kills himself and 32 fellow students…","Seung-Hui Cho kills himself and 32 fellow students at Virginia Tech in the deadliest campus gun rampage in U.S. history. President Bush and the First Lady attend the memorial. ","George W. Bush"
"2007/05/01","","Day","05/01/2007: Bush vetoes a war spending bill passed by Congress…","Bush vetoes a war spending bill passed by Congress, which set a timetable for troop withdrawal from Iraq. Within days Bush reaches a record low approval rating.","George W. Bush"
"2007/06/29","","Day","06/29/2007: The Supreme Court reverses an April decision and a…","The Supreme Court reverses an April decision and agrees to hear appeals from Guantanamo Bay detainees who have not had access to the federal courts.","George W. Bush"
"2007/07/26","","Day","07/26/2007: Congress passes the Antiterrorism Bill, which will…","Congress passes the Antiterrorism Bill, which will allow for the screening of air and sea cargo and will give more money in government antiterrorism grants to states with the greatest risk for terrorist attacks.","George W. Bush"
"2007/09/17","","Day","09/17/2007: President Bush names Michael Mukasey as Attorney G…","President Bush names Michael Mukasey as Attorney General after Alberto Gonzalez announces his resignation.","George W. Bush"
"2007/10/09","","Day","10/09/2007: The Dow Jones industrial average closes at 14,164,…","The Dow Jones industrial average closes at 14,164, its all-time high. Soon after, it begins a steep decline.","George W. Bush"
"2007/11/27","","Day","11/27/2007: President Bush hosts a Middle East Peace Conferenc…","President Bush hosts a Middle East Peace Conference in Annapolis, Maryland, with Prime Minister Ehud Olmert of Israel and Palestinian president Mahmoud Abbas.","George W. Bush"
"2007/12/19","","Day","12/19/2007: Congress passes new energy legislation to increase…","Congress passes new energy legislation to increase automobile fuel efficiency standards and mandates increases in biofuel production. The bill passes the House and Senate, and President Bush signs it into law. ","George W. Bush"
"2008/01/18","","Day","01/18/2008: President Bush proposes a $145 billion stimulus pa…","President Bush proposes a $145 billion stimulus package in response to a housing crisis and rapidly increasing oil prices. The package gives individuals several hundred dollars to facilitate spending, as well as rebates for children and tax deductions for businesses in order to jump-start the slowing economy.","George W. Bush"
"2008/01/31","","Day","01/31/2008: U.S. missile strikes in Pakistan kill a top al-Qae…","U.S. missile strikes in Pakistan kill a top al-Qaeda leader, Abu Laith al-Libi, who trained terror operatives in the region.","George W. Bush"
"2008/02/01","","Day","02/01/2008: The Bureau of Labor Statistics reports that the U.…","The Bureau of Labor Statistics reports that the U.S. economy lost more than 15,000 jobs during the previous month. Such an elimination of jobs from the economy had not occurred for more than four years. ","George W. Bush"
"2008/02/07","","Day","02/07/2008: The Senate passes a $170-billion stimulus package …","The Senate passes a $170-billion stimulus package to give many Americans tax rebates as large as $600 or more, and to implement tax breaks for certain businesses in an effort to head-off impending economic slowdown.","George W. Bush"
"2008/02/11","","Day","02/11/2008: Six detainees at Guantanamo Bay who were thought t…","Six detainees at Guantanamo Bay who were thought to have had roles in orchestrating the September 11 terrorist attacks are charged with conspiracy, murder in violation of the law of war, terrorism, and other charges. All six face the death penalty in military tribunals. ","George W. Bush"
"2008/03/23","","Day","03/23/2008: After a roadside bomb exploded in Baghdad, the U.S…","After a roadside bomb exploded in Baghdad, the U.S. death toll for the war in Iraq reached 4,000.","George W. Bush"
"2008/05/09","","Day","05/09/2008: The State Department renews a deal with Blackwater…","The State Department renews a deal with Blackwater Worldwide, the private defense contractor whose guards killed 17 civilians in 2007, to provide defense for U.S. diplomats in the Middle East.","George W. Bush"
"2008/05/22","","Day","05/22/2008: The House and Senate override President …","The House and Senate override President Bush&rsquo;s veto of the Farm Bill, a $307 billion bill which will provide subsidies to farmers. More than $10 billion of the funds will go to expanding nutritional programs such as food stamps. Bush originally vetoed the bill, which he felt to be excessive.","George W. Bush"
"2008/06/03","","Day","06/03/2008: Democratic candidate Barack Obama secures the part…","Democratic candidate Barack Obama secures the party&rsquo;s nomination for the presidency.","George W. Bush"
"2008/06/05","","Day","06/05/2008: The Senate Select Committee on Intelligence finds,…","The Senate Select Committee on Intelligence finds, after a five-year study, that President Bush and other officials greatly exaggerated the evidence showing that Saddam Hussein held weapons of mass destruction.","George W. Bush"
"2008/06/30","","Day","06/30/2008: In a new report issued on the situation in Iraq, t…","In a new report issued on the situation in Iraq, the U.S. Army admits that while it was able to adequately topple Hussein&rsquo;s regime, it did not have the capability to rebuild Iraq into a fully-functioning new country.","George W. Bush"
"2008/09/01","","Day","09/01/2008: U.S. forces hand over control of Anbar Province to…","U.S. forces hand over control of Anbar Province to the Iraqi military and police, who will now be responsible for maintaining order there. ","George W. Bush"
"2008/09/07","","Day","09/07/2008: The U.S. government places Fannie Mae and Freddie …","The U.S. government places Fannie Mae and Freddie Mac under its control to prevent the institutions from going under and endangering more than half of the country&rsquo;s mortgages.","George W. Bush"
"2008/10/01","","Day","10/01/2008: Senate approves an end to the long-standing ban on…","Senate approves an end to the long-standing ban on trading nuclear fuels with India, who will be able to purchase fuel on the market as long as it is for civilian purposes.","George W. Bush"
"2008/10/03","","Day","10/03/2008: At the onset of financial crisis, President Bush s…","At the onset of financial crisis, President Bush signs a $700 billion bailout plan for failing bank assets, the largest in U.S. history.","George W. Bush"
"2008/10/30","","Day","10/30/2008: U.S. gross domestic product drops by 0.3 percent, …","U.S. gross domestic product drops by 0.3 percent, the first time GDP has shrunk in 17 years.","George W. Bush"
"2008/10/31","","Day","10/31/2008: General David Petraeus takes over as Head of Centr…","General David Petraeus takes over as Head of Central Command, overseeing all U.S. military operations in Iraq, Afghanistan, Pakistan, Syria, and Iran.","George W. Bush"
"2008/11/04","","Day","11/04/2008: Barack Obama is elected the next President of the …","Barack Obama is elected the next President of the United States in an historic election in which Democrats win in several traditionally Republican states and pick up seats in the House and Senate. Obama is the first African American elected President.","George W. Bush"
"2008/11/25","","Day","11/25/2008: The Treasury Department and the Federal Reserve ag…","The Treasury Department and the Federal Reserve agree to provide another $800 billion in lending programs to buy debt insured by Fannie Mae and Freddie Mac and to provide more small loans to consumers.","George W. Bush"
"2008/12/16","","Day","12/16/2008: Federal Reserve cuts interest rates to an all-time…","Federal Reserve cuts interest rates to an all-time low of zero percent, down from 1 percent and 0.25 percent earlier in the year as part of a plan to stimulate the economy.","George W. Bush"
"2008/12/19","","Day","12/19/2008: President Bush issues a $17.4-billion auto bailout…","President Bush issues a $17.4-billion auto bailout to General Motors and Chrysler to keep the two American automotive giants from going bankrupt.  ","George W. Bush"
"2009/01/20","","Day","01/20/2009: Barack Obama is inaugurated the 44th President of …","Barack Obama is inaugurated the 44th President of the United States. President Bush leaves Washington, D.C., and settles in Dallas, Texas. ","George W. Bush"
